ST.INT.ARVL,CC BY-4.0,"International tourism, number of arrivals","International inbound tourists (overnight visitors) are the number of tourists who travel to a country other than that in which they usually reside, and outside their usual environment, for a period not exceeding 12 months and whose main purpose in visiting is other than an activity remunerated from within the country visited. When data on number of tourists are not available, the number of visitors, which includes tourists, same-day visitors, cruise passengers, and
crew members, is shown instead.","International inbound tourists (overnight visitors) are the number of tourists who travel to a country other than that in which they have their usual residence, but outside their usual environment, for a period not exceeding 12 months and whose main purpose in visiting is other than an activity remunerated from within the country visited. When data on number of tourists are not available, the number of visitors, which includes tourists, same-day visitors, cruise passengers, and crew members, is shown instead. Sources and collection methods for arrivals differ across countries. In some cases data are from border statistics (police, immigration, and the like) and supplemented by border surveys. In other cases data are from tourism accommodation establishments. For some countries number of arrivals is limited to arrivals by air and for others to arrivals staying in hotels. Some countries include arrivals of nationals residing abroad while others do not. Caution should thus be used in comparing arrivals across countries. The data on inbound tourists refer to the number of arrivals, not to the number of people traveling. Thus a person who makes several trips to a country during a given period is counted each time as a new arrival.","World Tourism Organization, Yearbook of Tourism Statistics, Compendium of Tourism Statistics and data files.",Private Sector & Trade: Travel & tourism,,,Annual,,Gap-filled total,"Statistical information on tourism is based mainly on data on arrivals and overnight stays along with balance of payments information. These data do not completely capture the economic phenomenon of tourism or provide the information needed for effective public policies and efficient business operations. Data are needed on the scale and significance of tourism. Information on the role of tourism in national economies is particularly deficient. Although the World Tourism Organization reports progress in harmonizing definitions and measurement, differences in national practices still prevent full comparability.

Arrivals data measure the flows of international visitors to the country of reference: each arrival corresponds to one in inbound tourism trip. If a person visits several countries during the course of a single trip, his/her arrival in each country is recorded separately. In an accounting period, arrivals are not necessarily equal to the number of persons travelling (when a person visits the same country several times a year, each trip by the same person is counted as a separate arrival).

Arrivals data should correspond to inbound visitors by including both tourists and same-day non-resident visitors. All other types of travelers (such as border, seasonal and other short-term workers, long-term students and others) should be excluded as they do not qualify as visitors.

Data are obtained from different sources: administrative records (immigration, traffic counts, and other possible types of controls), border surveys or a mix of them. If data are obtained from accommodation surveys, the number of guests is used as estimate of arrival figures; consequently, in this case, breakdowns by regions, main purpose of the trip, modes of transport used or forms of organization of the trip are based on complementary visitor surveys.","Tourism is officially recognized as a directly measurable activity, enabling more accurate analysis and more effective policy. Whereas previously the sector relied mostly on approximations from related areas of measurement (e.g. Balance of Payments statistics), tourism today possesses a range of instruments to track its productive activities and the activities of the consumers that drive them: visitors (both tourists and excursionists).

An increasing number of countries have opened up and invested in tourism development, making tourism a key driver of socio-economic progress through export revenues, the creation of jobs and enterprises, and infrastructure development. As an internationally traded service, inbound tourism has become one of the world's major trade categories. For many developing countries it is one of the main sources of foreign exchange income and a major component of exports, creating much needed employment and development opportunities.","Tourism can be either domestic or international. The data refers to international tourism, where the traveler's country of residence differs from the visiting country. International tourism consists of inbound (arrival) and outbound (departures) tourism.

The data are from the World Tourism Organization (WTO), a United Nations agency. The data on inbound and outbound tourists refer to the number of arrivals and departures, not to the number of people traveling. Thus a person who makes several trips to a country during a given period is counted each time as a new arrival. The data on inbound tourism show the arrivals of nonresident tourists (overnight visitors) at national borders. When data on international tourists are unavailable or incomplete, the data show the arrivals of international visitors, which include tourists, same-day visitors, cruise passengers, and crew members.

Sources and collection methods for arrivals differ across countries. In some cases data are from border statistics (police, immigration, and the like) and supplemented by border surveys. In other cases data are from tourism accommodation establishments. For some countries number of arrivals is limited to arrivals by air and for others to arrivals staying in hotels. Some countries include arrivals of nationals residing abroad while others do not. Caution should thus be used in comparing arrivals across countries.",,https://datacatalog.worldbank.org/public-licenses#cc-by
ST.INT.XPND.CD,CC BY-4.0,"International tourism, expenditures (current US$)",,"International tourism expenditures are expenditures of international outbound visitors in other countries, including payments to foreign carriers for international transport. These expenditures may include those by residents traveling abroad as same-day visitors, except in cases where these are important enough to justify separate classification. For some countries they do not include expenditures for passenger transport items. Data are in current U.S. dollars.","World Tourism Organization, Yearbook of Tourism Statistics, Compendium of Tourism Statistics and data files.",Private Sector & Trade: Travel & tourism,,,Annual,,Gap-filled total,"Outbound tourism expenditures may include those by residents traveling abroad as same-day visitors, except when these are important enough to justify separate classification. For some countries they do not include expenditures for passenger transport items. Their share in imports is calculated as a ratio to imports of goods and services (all transactions between residents of a country and the rest of the world involving a change of ownership from nonresidents to residents of general merchandise, goods sent for processing and repairs, nonmonetary gold, and services).

Statistical information on tourism is based mainly on data on arrivals and overnight stays along with balance of payments information. These data do not completely capture the economic phenomenon of tourism or provide the information needed for effective public policies and efficient business operations. Data are needed on the scale and significance of tourism. Information on the role of tourism in national economies is particularly deficient. Although the World Tourism Organization reports progress in harmonizing definitions and measurement, differences in national practices still prevent full comparability.

The World Tourism Organization is improving its coverage of tourism expenditure data, using balance of payments data from the International Monetary Fund (IMF) supplemented by data from individual countries. These data include travel and passenger transport items as defined in the IMF's Balance of Payments. When the IMF does not report data on passenger transport items, expenditure data for travel items are shown.

The aggregates are calculated using the World Bank's weighted aggregation methodology and differ from the World Tourism Organization's aggregates.","Tourism is officially recognized as a directly measurable activity, enabling more accurate analysis and more effective policy. Whereas previously the sector relied mostly on approximations from related areas of measurement (e.g. Balance of Payments statistics), tourism today possesses a range of instruments to track its productive activities and the activities of the consumers that drive them: visitors (both tourists and excursionists).

An increasing number of countries have opened up and invested in tourism development, making tourism a key driver of socio-economic progress through export revenues, the creation of jobs and enterprises, and infrastructure development. As an internationally traded service, inbound tourism has become one of the world's major trade categories. For many developing countries it is one of the main sources of foreign exchange income and a major component of exports, creating much needed employment and development opportunities.","Tourism can be either domestic or international. The data refers to international tourism, where the traveler's country of residence differs from the visiting country. International tourism consists of inbound (arrival) and outbound (departures) tourism.

The data are from the World Tourism Organization (WTO), a United Nations agency. The data on inbound and outbound tourists refer to the number of arrivals and departures, not to the number of people traveling.

Expenditure associated with the activity of international visitors has been traditionally identified with the travel item of the Balance of Payments (BOP).

The 2008 International Recommendations for Tourism Statistics consider that "tourism industries and products" includes transport of passengers. Consequently, a better estimate of tourism-related expenditure by inbound and outbound visitors in an international scenario would be, in terms of the BOP, the value of the travel item plus that of the passenger transport item.

Nevertheless, users should be aware that BOP estimates include, in addition to expenditures associated to visitors, those related to other types of travelers (these might be substantial in some countries; for instance, long-term students or patients, border and seasonal workers, etc.). Also data on expenditure by main purpose of the trip are BOP data.",,https://datacatalog.worldbank.org/public-licenses#cc-by
NV.IND.TOTL.ZS,CC BY-4.0,"Industry (including construction), value added (% of GDP)",,"Industry (including construction) corresponds to ISIC divisions 05-43 and includes manufacturing (ISIC divisions 10-33). It comprises value added in mining, manufacturing (also reported as a separate subgroup), construction, electricity, water, and gas. Value added is the net output of a sector after adding up all outputs and subtracting intermediate inputs. It is calculated without making deductions for depreciation of fabricated assets or depletion and degradation of natural resources. The origin of value added is determined by the International Standard Industrial Classification (ISIC), revision 4. Note: For VAB countries, gross value added at factor cost is used as the denominator.","World Bank national accounts data, and OECD National Accounts data files.",Economic Policy & Debt: National accounts: Shares of GDP & other,,,Annual,,Weighted average,"Gross domestic product (GDP) represents the sum of value added by all its producers. Value added is the value of the gross output of producers less the value of intermediate goods and services consumed in production, before accounting for consumption of fixed capital in production. The United Nations System of National Accounts calls for value added to be valued at either basic prices (excluding net taxes on products) or producer prices (including net taxes on products paid by producers but excluding sales or value added taxes). Both valuations exclude transport charges that are invoiced separately by producers. Total GDP is measured at purchaser prices. Value added by industry is normally measured at basic prices.",,"Ideally, industrial output should be measured through regular censuses and surveys of firms. But in most developing countries such surveys are infrequent, so earlier survey results must be extrapolated using an appropriate indicator. The choice of sampling unit, which may be the enterprise (where responses may be based on financial records) or the establishment (where production units may be recorded separately), also affects the quality of the data. Moreover, much industrial production is organized in unincorporated or owner-operated ventures that are not captured by surveys aimed at the formal sector. Even in large industries, where regular surveys are more likely, evasion of excise and other taxes and nondisclosure of income lower the estimates of value added. Such problems become more acute as countries move from state control of industry to private enterprise, because new firms and growing numbers of established firms fail to report. In accordance with the System of National Accounts, output should include all such unreported activity as well as the value of illegal activities and other unrecorded, informal, or small-scale operations. Data on these activities need to be collected using techniques other than conventional surveys of firms.","Note: Data for OECD countries are based on ISIC, revision 4.",https://datacatalog.worldbank.org/public-licenses#cc-by
EN.GHG.CO2.AG.MT.CE.AR5,CC BY-4.0,Carbon dioxide (CO2) emissions from Agriculture (Mt CO2e),,"A measure of annual emissions of carbon dioxide (CO2), one of the six Kyoto greenhouse gases (GHG), from the agricultural sector. This includes emissions from livestock (IPCC 2006 codes 3.A.1 (enteric fermentation, 3.a.2 (manure management) and crops (IPCC 2006 codes 3.C.1 Emissions from biomass burning, 3.C.2 Liming, 3.C.3 Urea application, 3.C.4 Direct N2O Emissions from managed soils, 3.C.5 Indirect N2O Emissions from managed soils, 3.C.6 Indirect N2O Emissions from manure management, 3.C.7 Rice cultivations). The measure is standardized to carbon dioxide equivalent values using the Global Warming Potential (GWP) factors of IPCC's 5th Assessment Report (AR5).","EDGAR (Emissions Database for Global Atmospheric Research) Community GHG Database, a collaboration between the European Commission, Joint Research Centre (JRC), the International Energy Agency (IEA), and comprising IEA-EDGAR CO2, EDGAR CH4, EDGAR N2O, EDGAR F-GASES version 8.0, (2023) European Commission, JRC (Datasets). https://edgar.jrc.ec.europa.eu/dataset_ghg73",,WDI,Mt CO2eq,Annual,,Sum,,"Anthropogenic (human-caused) emissions of global greenhouse gases, including carbon dioxide (CO2), methane (CH4), nitrous oxide (NO2) and F-gases, lead to an increase of the concentration of greenhouse gases in the atmosphere, which in turn causes atmospheric warming by trapping heat in the atmosphere (greenhouse gas effect). Atmospheric warming leads to climatic changes causing more frequent and extreme weather events and higher temperatures globally, leading to large impacts across the globe and particularly in developing countries that often have a limited means to adapt and build resilience. The international scientific community has warned that emissions need to decline to net zero by the middle of the 21st century to limit global warming to well below a 2deg C increase and help avoid the most consequential climate change impacts. 

Climate change is having a disproportionate impact on developing countries and if unabated will not only reverse past development progress and hinder poverty reduction but will also make future development more costly. Country level assessments of the potential climate change impacts on specific developing countries, performed as part of the World Bank’s Country Climate and Development Reports (CCDRs), show that climate change will have a significant impact on developing countries’ economies, ranging from about 0.5% of GDP for higher income developing countries to over 13% for the lowest income developing countries. The costs of partial adaptation to these changes will be significant as well -- ranging between 1 and 10% of developing countries’ GDP.","Global GHG emissions are currently not directly measurable, but approaches for their estimation exist, and numerous sources exist to supply data for this indicator. Reputable scientific organizations produce these data for use for research, policy analysis, climate negotiations, and broader public communications. The estimated accuracy from fossil fuel combustion and industrial processes are quite high, as quantities of fossil fuels and other emissive materials (such as cement and steel) produced are well known. For these sectors, emissions estimates are roughly accurate to within 10% when aggregated to the global level and between 4% and 35% at the country level (Crippa et al., 2023). For non- combustion and non- industrial process emissions, the accuracy is lower. Agricultural emissions, for example, depend upon many factors including the type of crops grown and livestock raised, specific agricultural practices, and other climate and non-climate factors. For these emissions, the accuracy is lower—around 30% for CH4 and fluorinated gases (HFCs, PFCs, and SF6).",,https://datacatalog.worldbank.org/public-licenses#cc-by
EN.GHG.CO2.BU.MT.CE.AR5,CC BY-4.0,Carbon dioxide (CO2) emissions from Building (Energy) (Mt CO2e),,"A measure of annual emissions of carbon dioxide (CO2), one of the six Kyoto greenhouse gases (GHG), from the building sector (subsector of the energy sector) including IPCC 2006 codes 1.A.4 Residential and other sectors, 1.A.5 Non-Specified. The measure is standardized to carbon dioxide equivalent values using the Global Warming Potential (GWP) factors of IPCC's 5th Assessment Report (AR5).","EDGAR (Emissions Database for Global Atmospheric Research) Community GHG Database, a collaboration between the European Commission, Joint Research Centre (JRC), the International Energy Agency (IEA), and comprising IEA-EDGAR CO2, EDGAR CH4, EDGAR N2O, EDGAR F-GASES version 8.0, (2023) European Commission, JRC (Datasets). https://edgar.jrc.ec.europa.eu/dataset_ghg74",,WDI,Mt CO2eq,Annual,,Sum,,"Anthropogenic (human-caused) emissions of global greenhouse gases, including carbon dioxide (CO2), methane (CH4), nitrous oxide (NO2) and F-gases, lead to an increase of the concentration of greenhouse gases in the atmosphere, which in turn causes atmospheric warming by trapping heat in the atmosphere (greenhouse gas effect). Atmospheric warming leads to climatic changes causing more frequent and extreme weather events and higher temperatures globally, leading to large impacts across the globe and particularly in developing countries that often have a limited means to adapt and build resilience. The international scientific community has warned that emissions need to decline to net zero by the middle of the 21st century to limit global warming to well below a 2deg C increase and help avoid the most consequential climate change impacts. 

Climate change is having a disproportionate impact on developing countries and if unabated will not only reverse past development progress and hinder poverty reduction but will also make future development more costly. Country level assessments of the potential climate change impacts on specific developing countries, performed as part of the World Bank’s Country Climate and Development Reports (CCDRs), show that climate change will have a significant impact on developing countries’ economies, ranging from about 0.5% of GDP for higher income developing countries to over 13% for the lowest income developing countries. The costs of partial adaptation to these changes will be significant as well -- ranging between 1 and 10% of developing countries’ GDP.","Global GHG emissions are currently not directly measurable, but approaches for their estimation exist, and numerous sources exist to supply data for this indicator. Reputable scientific organizations produce these data for use for research, policy analysis, climate negotiations, and broader public communications. The estimated accuracy from fossil fuel combustion and industrial processes are quite high, as quantities of fossil fuels and other emissive materials (such as cement and steel) produced are well known. For these sectors, emissions estimates are roughly accurate to within 10% when aggregated to the global level and between 4% and 35% at the country level (Crippa et al., 2023). For non- combustion and non- industrial process emissions, the accuracy is lower. Agricultural emissions, for example, depend upon many factors including the type of crops grown and livestock raised, specific agricultural practices, and other climate and non-climate factors. For these emissions, the accuracy is lower—around 30% for CH4 and fluorinated gases (HFCs, PFCs, and SF6).",,https://datacatalog.worldbank.org/public-licenses#cc-by
EN.GHG.CO2.FE.MT.CE.AR5,CC BY-4.0,Carbon dioxide (CO2) emissions from Fugitive Emissions (Energy) (Mt CO2e),,"A measure of annual emissions of carbon dioxide (CO2), one of the six Kyoto greenhouse gases (GHG), from fugitive emissions (subsector of the energy sector) including IPCC 2006 codes 1.A.1.bc Petroleum Refining - Manufacture of Solid Fuels and Other Energy Industries, 1.B.1 Solid Fuels, 1.B.2 Oil and Natural Gas, 5.B. The measure is standardized to carbon dioxide equivalent values using the Global Warming Potential (GWP) factors of IPCC's 5th Assessment Report (AR5).","EDGAR (Emissions Database for Global Atmospheric Research) Community GHG Database, a collaboration between the European Commission, Joint Research Centre (JRC), the International Energy Agency (IEA), and comprising IEA-EDGAR CO2, EDGAR CH4, EDGAR N2O, EDGAR F-GASES version 8.0, (2023) European Commission, JRC (Datasets). https://edgar.jrc.ec.europa.eu/dataset_ghg75",,WDI,Mt CO2eq,Annual,,Sum,,"Anthropogenic (human-caused) emissions of global greenhouse gases, including carbon dioxide (CO2), methane (CH4), nitrous oxide (NO2) and F-gases, lead to an increase of the concentration of greenhouse gases in the atmosphere, which in turn causes atmospheric warming by trapping heat in the atmosphere (greenhouse gas effect). Atmospheric warming leads to climatic changes causing more frequent and extreme weather events and higher temperatures globally, leading to large impacts across the globe and particularly in developing countries that often have a limited means to adapt and build resilience. The international scientific community has warned that emissions need to decline to net zero by the middle of the 21st century to limit global warming to well below a 2deg C increase and help avoid the most consequential climate change impacts. 

Climate change is having a disproportionate impact on developing countries and if unabated will not only reverse past development progress and hinder poverty reduction but will also make future development more costly. Country level assessments of the potential climate change impacts on specific developing countries, performed as part of the World Bank’s Country Climate and Development Reports (CCDRs), show that climate change will have a significant impact on developing countries’ economies, ranging from about 0.5% of GDP for higher income developing countries to over 13% for the lowest income developing countries. The costs of partial adaptation to these changes will be significant as well -- ranging between 1 and 10% of developing countries’ GDP.","Global GHG emissions are currently not directly measurable, but approaches for their estimation exist, and numerous sources exist to supply data for this indicator. Reputable scientific organizations produce these data for use for research, policy analysis, climate negotiations, and broader public communications. The estimated accuracy from fossil fuel combustion and industrial processes are quite high, as quantities of fossil fuels and other emissive materials (such as cement and steel) produced are well known. For these sectors, emissions estimates are roughly accurate to within 10% when aggregated to the global level and between 4% and 35% at the country level (Crippa et al., 2023). For non- combustion and non- industrial process emissions, the accuracy is lower. Agricultural emissions, for example, depend upon many factors including the type of crops grown and livestock raised, specific agricultural practices, and other climate and non-climate factors. For these emissions, the accuracy is lower—around 30% for CH4 and fluorinated gases (HFCs, PFCs, and SF6).",,https://datacatalog.worldbank.org/public-licenses#cc-by
