NE.IMP.GNFS.CD,CC BY-4.0,Imports of goods and services (current US$),,"Imports of goods and services represent the value of all goods and other market services received from the rest of the world. They include the value of merchandise, freight, insurance, transport, travel, royalties, license fees, and other services, such as communication, construction, financial, information, business, personal, and government services. They exclude compensation of employees and investment income (formerly called factor services) and transfer payments. Data are in current U.S. dollars.","World Bank national accounts data, and OECD National Accounts data files.",Economic Policy & Debt: National accounts: US$ at current prices: Expenditure on GDP,,,Annual,,Gap-filled total,"Gross domestic product (GDP) from the expenditure side is made up of household final consumption expenditure, general government final consumption expenditure, gross capital formation (private and public investment in fixed assets, changes in inventories, and net acquisitions of valuables), and net exports (exports minus imports) of goods and services. Such expenditures are recorded in purchaser prices and include net taxes on products.",,"Because policymakers have tended to focus on fostering the growth of output, and because data on production are easier to collect than data on spending, many countries generate their primary estimate of GDP using the production approach. Moreover, many countries do not estimate all the components of national expenditures but instead derive some of the main aggregates indirectly using GDP (based on the production approach) as the control total.

Data on exports and imports are compiled from customs reports and balance of payments data. Although the data from the payments side provide reasonably reliable records of cross-border transactions, they may not adhere strictly to the appropriate definitions of valuation and timing used in the balance of payments or corresponds to the change-of ownership criterion. This issue has assumed greater significance with the increasing globalization of international business. Neither customs nor balance of payments data usually capture the illegal transactions that occur in many countries. Goods carried by travelers across borders in legal but unreported shuttle trade may further distort trade statistics.",,https://datacatalog.worldbank.org/public-licenses#cc-by
NE.EXP.GNFS.KD,CC BY-4.0,Exports of goods and services (constant 2015 US$),,"Exports of goods and services represent the value of all goods and other market services provided to the rest of the world. They include the value of merchandise, freight, insurance, transport, travel, royalties, license fees, and other services, such as communication, construction, financial, information, business, personal, and government services. They exclude compensation of employees and investment income (formerly called factor services) and transfer payments. Data are in constant 2015 prices, expressed in U.S. dollars.","World Bank national accounts data, and OECD National Accounts data files.",Economic Policy & Debt: National accounts: US$ at constant 2015 prices: Expenditure on GDP,,,Annual,2015,Gap-filled total,"Gross domestic product (GDP) from the expenditure side is made up of household final consumption expenditure, general government final consumption expenditure, gross capital formation (private and public investment in fixed assets, changes in inventories, and net acquisitions of valuables), and net exports (exports minus imports) of goods and services. Such expenditures are recorded in purchaser prices and include net taxes on products.","An economy's growth is measured by the change in the volume of its output or in the real incomes of its residents. The 2008 United Nations System of National Accounts (2008 SNA) offers three plausible indicators for calculating growth: the volume of gross domestic product (GDP), real gross domestic income, and real gross national income. The volume of GDP is the sum of value added, measured at constant prices, by households, government, and industries operating in the economy. GDP accounts for all domestic production, regardless of whether the income accrues to domestic or foreign institutions.","Because policymakers have tended to focus on fostering the growth of output, and because data on production are easier to collect than data on spending, many countries generate their primary estimate of GDP using the production approach. Moreover, many countries do not estimate all the components of national expenditures but instead derive some of the main aggregates indirectly using GDP (based on the production approach) as the control total.

Data on exports and imports are compiled from customs reports and balance of payments data. Although the data from the payments side provide reasonably reliable records of cross-border transactions, they may not adhere strictly to the appropriate definitions of valuation and timing used in the balance of payments or corresponds to the change-of ownership criterion. This issue has assumed greater significance with the increasing globalization of international business. Neither customs nor balance of payments data usually capture the illegal transactions that occur in many countries. Goods carried by travelers across borders in legal but unreported shuttle trade may further distort trade statistics.",,https://datacatalog.worldbank.org/public-licenses#cc-by
NE.EXP.GNFS.CD,CC BY-4.0,Exports of goods and services (current US$),,"Exports of goods and services represent the value of all goods and other market services provided to the rest of the world. They include the value of merchandise, freight, insurance, transport, travel, royalties, license fees, and other services, such as communication, construction, financial, information, business, personal, and government services. They exclude compensation of employees and investment income (formerly called factor services) and transfer payments. Data are in current U.S. dollars.","World Bank national accounts data, and OECD National Accounts data files.",Economic Policy & Debt: National accounts: US$ at current prices: Expenditure on GDP,,,Annual,,Gap-filled total,"Gross domestic product (GDP) from the expenditure side is made up of household final consumption expenditure, general government final consumption expenditure, gross capital formation (private and public investment in fixed assets, changes in inventories, and net acquisitions of valuables), and net exports (exports minus imports) of goods and services. Such expenditures are recorded in purchaser prices and include net taxes on products.",,"Because policymakers have tended to focus on fostering the growth of output, and because data on production are easier to collect than data on spending, many countries generate their primary estimate of GDP using the production approach. Moreover, many countries do not estimate all the components of national expenditures but instead derive some of the main aggregates indirectly using GDP (based on the production approach) as the control total.

Data on exports and imports are compiled from customs reports and balance of payments data. Although the data from the payments side provide reasonably reliable records of cross-border transactions, they may not adhere strictly to the appropriate definitions of valuation and timing used in the balance of payments or corresponds to the change-of ownership criterion. This issue has assumed greater significance with the increasing globalization of international business. Neither customs nor balance of payments data usually capture the illegal transactions that occur in many countries. Goods carried by travelers across borders in legal but unreported shuttle trade may further distort trade statistics.",,https://datacatalog.worldbank.org/public-licenses#cc-by
BX.KLT.DINV.CD.WD,CC BY-4.0,"Foreign direct investment, net inflows (BoP, current US$)",,"Foreign direct investment refers to direct investment equity flows in the reporting economy. It is the sum of equity capital, reinvestment of earnings, and other capital. Direct investment is a category of cross-border investment associated with a resident in one economy having control or a significant degree of influence on the management of an enterprise that is resident in another economy. Ownership of 10 percent or more of the ordinary shares of voting stock is the criterion for determining the existence of a direct investment relationship. Data are in current U.S. dollars.","International Monetary Fund, Balance of Payments database, supplemented by data from the United Nations Conference on Trade and Development and official national sources.",Economic Policy & Debt: Balance of payments: Capital & financial account,,,Annual,,Sum,"Data on equity flows are based on balance of payments data reported by the International Monetary Fund (IMF). Foreign direct investment (FDI) data are supplemented by the World Bank staff estimates using data from the United Nations Conference on Trade and Development (UNCTAD) and official national sources.

The internationally accepted definition of FDI (from the sixth edition of the IMF's Balance of Payments Manual [2009]), includes the following components: equity investment, including investment associated with equity that gives rise to control or influence; investment in indirectly influenced or controlled enterprises; investment in fellow enterprises; debt (except selected debt); and reverse investment. The Framework for Direct Investment Relationships provides criteria for determining whether cross-border ownership results in a direct investment relationship, based on control and influence. Distinguished from other kinds of international investment, FDI is made to establish a lasting interest in or effective management control over an enterprise in another country. A lasting interest in an investment enterprise typically involves establishing warehouses, manufacturing facilities, and other permanent or long-term organizations abroad. Direct investments may take the form of greenfield investment, where the investor starts a new venture in a foreign country by constructing new operational facilities; joint venture, where the investor enters into a partnership agreement with a company abroad to establish a new enterprise; or merger and acquisition, where the investor acquires an existing enterprise abroad. The IMF suggests that investments should account for at least 10 percent of voting stock to be counted as FDI. In practice many countries set a higher threshold. Many countries fail to report reinvested earnings, and the definition of long-term loans differs among countries. BoP refers to Balance of Payments.","Private financial flows - equity and debt - account for the bulk of development finance. Equity flows comprise foreign direct investment (FDI) and portfolio equity. Debt flows are financing raised through bond issuance, bank lending, and supplier credits.","FDI data do not give a complete picture of international investment in an economy. Balance of payments data on FDI do not include capital raised locally, an important source of investment financing in some developing countries. In addition, FDI data omit nonequity cross-border transactions such as intra-unit flows of goods and services.

The volume of global private financial flows reported by the World Bank generally differs from that reported by other sources because of differences in sources, classification of economies, and method used to adjust and disaggregate reported information. In addition, particularly for debt financing, differences may also reflect how some installments of the transactions and certain offshore issuances are treated.

Data on equity flows are shown for all countries for which data are available.",Note: Data starting from 2005 are based on the sixth edition of the IMF's Balance of Payments Manual (BPM6).,https://datacatalog.worldbank.org/public-licenses#cc-by
SP.POP.TOTL,CC BY-4.0,"Population, total",,"Total population is based on the de facto definition of population, which counts all residents regardless of legal status or citizenship. The values shown are midyear estimates.",(1) United Nations Population Division. World Population Prospects: 2024 Revision; (2) Statistical databases and publications from national statistical offices; (3) Eurostat: Demographic Statistics; (4) United Nations Statistics Division. Population and Vital Statistics Report (various years).,Health: Population: Structure,,,Annual,,Sum,"Population estimates are usually based on national population censuses, and estimates of fertility, mortality and migration.

Errors and undercounting in census occur even in high-income countries.  In developing countries errors may be substantial because of limits in the transport, communications, and other resources required to conduct and analyze a full census.

The quality and reliability of official demographic data are also affected by public trust in the government, government commitment to full and accurate enumeration, confidentiality and protection against misuse of census data, and census agencies' independence from political influence. Moreover, comparability of population indicators is limited by differences in the concepts, definitions, collection procedures, and estimation methods used by national statistical agencies and other organizations that collect the data.

The currentness of a census and the availability of complementary data from surveys or registration systems are objective ways to judge demographic data quality. Some European countries' registration systems offer complete information on population in the absence of a census.

The United Nations Statistics Division monitors the completeness of vital registration systems. Some developing countries have made progress over the last 60 years, but others still have deficiencies in civil registration systems.

International migration is the only other factor besides birth and death rates that directly determines a country's population change. Estimating migration is difficult. At any time many people are located outside their home country as tourists, workers, or refugees or for other reasons. Standards for the duration and purpose of international moves that qualify as migration vary, and estimates require information on flows into and out of countries that is difficult to collect.

Population projections, starting from a base year are projected forward using assumptions of mortality, fertility, and migration by age and sex through 2050, based on the UN Population Division's World Population Prospects database medium variant.","Increases in human population, whether as a result of immigration or more births than deaths, can impact natural resources and social infrastructure.  This can place pressure on a country's sustainability.  A significant growth in population will negatively impact the availability of land for agricultural production, and will aggravate demand for food, energy, water, social services, and infrastructure. On the other hand, decreasing population size - a result of fewer births than deaths, and people moving out of a country - can impact a government's commitment to maintain services and infrastructure.","Current population estimates for developing countries that lack (i) reliable recent census data, and (ii) pre- and post-census estimates for countries with census data, are provided by the United Nations Population Division and other agencies. 

The cohort component method - a standard method for estimating and projecting population - requires fertility, mortality, and net migration data, often collected from sample surveys, which can be small or limited in coverage. Population estimates are from demographic modeling and so are susceptible to biases and errors from shortcomings in both the model and the data.

Because future trends cannot be known with certainty, population projections have a wide range of uncertainty.",Relevance to gender indicator: disaggregating the population composition by gender will help a country in projecting its demand for social services on a gender basis.,https://datacatalog.worldbank.org/public-licenses#cc-by
SP.POP.0014.TO,CC BY-4.0,"Population ages 0-14, total",,"Total population between the ages 0 to 14. Population is based on the de facto definition of population, which counts all residents regardless of legal status or citizenship.",World Bank staff estimates using the World Bank's total population and age/sex distributions of the United Nations Population Division's World Population Prospects: 2024 Revision.,Health: Population: Structure,,,Annual,,Sum,,,,,https://datacatalog.worldbank.org/public-licenses#cc-by
SP.POP.1564.TO,CC BY-4.0,"Population ages 15-64, total",,"Total population between the ages 15 to 64. Population is based on the de facto definition of population, which counts all residents regardless of legal status or citizenship.",World Bank staff estimates using the World Bank's total population and age/sex distributions of the United Nations Population Division's World Population Prospects: 2024 Revision.,Health: Population: Structure,,,Annual,,Sum,,,,,https://datacatalog.worldbank.org/public-licenses#cc-by
SP.POP.65UP.TO,CC BY-4.0,"Population ages 65 and above, total",,"Total population 65 years of age or older. Population is based on the de facto definition of population, which counts all residents regardless of legal status or citizenship.",World Bank staff estimates using the World Bank's total population and age/sex distributions of the United Nations Population Division's World Population Prospects: 2024 Revision.,Health: Population: Structure,,,Annual,,Sum,,,,,https://datacatalog.worldbank.org/public-licenses#cc-by
SL.UEM.TOTL.NE.ZS,CC BY-4.0,"Unemployment, total (% of total labor force) (national estimate)",,Unemployment refers to the share of the labor force that is without work but available for and seeking employment. Definitions of labor force and unemployment differ by country.,"International Labour Organization. “Labour Force Statistics database (LFS)” ILOSTAT. Accessed January 07, 2025. https://ilostat.ilo.org/data/.",Social Protection & Labor: Unemployment,,,Annual,,Weighted average,"The standard definition of unemployed persons is those individuals without work, seeking work in a recent past period, and currently available for work, including people who have lost their jobs or who have voluntarily left work. Persons who did not look for work but have an arrangements for a future job are also counted as unemployed. 

Some unemployment is unavoidable. At any time some workers are temporarily unemployed between jobs as employers look for the right workers and workers search for better jobs. It is the labour force or the economically active portion of the population that serves as the base for this indicator, not the total population.","Paradoxically, low unemployment rates can disguise substantial poverty in a country, while high unemployment rates can occur in countries with a high level of economic development and low rates of poverty. In countries without unemployment or welfare benefits people eke out a living in vulnerable employment. In countries with well-developed safety nets workers can afford to wait for suitable or desirable jobs. But high and sustained unemployment indicates serious inefficiencies in resource allocation.

Youth unemployment is an important policy issue for many economies. Young men and women today face increasing uncertainty in their hopes of undergoing a satisfactory transition in the labour market, and this uncertainty and disillusionment can, in turn, have damaging effects on individuals, communities, economies and society at large. Unemployed or underemployed youth are less able to contribute effectively to national development and have fewer opportunities to exercise their rights as citizens. They have less to spend as consumers, less to invest as savers and often have no "voice" to bring about change in their lives and communities. Widespread youth unemployment and underemployment also prevents companies and countries from innovating and developing competitive advantages based on human capital investment, thus undermining future prospects.

Unemployment is a key measure to monitor whether a country is on track to achieve the Sustainable Development Goal of promoting sustained, inclusive and sustainable economic growth, full and productive employment and decent work for all. [SDG Indicator 8.5.2]","The criteria for people considered to be seeking work, and the treatment of people temporarily laid off or seeking work for the first time, vary across countries. In many cases it is especially difficult to measure employment and unemployment in agriculture. The timing of a survey can maximize the effects of seasonal unemployment in agriculture. And informal sector employment is difficult to quantify where informal activities are not tracked.

There may be also persons not currently in the labour market who want to work but do not actively "seek" work because they view job opportunities as limited, or because they have restricted labour mobility, or face discrimination, or structural, social or cultural barriers. The exclusion of people who want to work but are not seeking work (often called the "hidden unemployed" or "discouraged workers") is a criterion that will affect the unemployment count of both women and men. 

However, women tend to be excluded from the count for various reasons. Women suffer more from discrimination and from structural, social, and cultural barriers that impede them from seeking work. Also, women are often responsible for the care of children and the elderly and for household affairs. They may not be available for work during the short reference period, as they need to make arrangements before starting work. Further, women are considered to be employed when they are working part-time or in temporary jobs, despite the instability of these jobs or their active search for more secure employment.",The series for ILO estimates is also available in the WDI database. Caution should be used when comparing ILO estimates with national estimates.,https://datacatalog.worldbank.org/public-licenses#cc-by
