Country Name,Country Code,Series Name,Series Code,2011 [YR2011],2012 [YR2012],2013 [YR2013],2014 [YR2014],2015 [YR2015],2016 [YR2016],2017 [YR2017],2018 [YR2018],2019 [YR2019],2020 [YR2020],2021 [YR2021],2022 [YR2022],2023 [YR2023]
Viet Nam,VNM,"Agriculture, forestry, and fishing, value added (% of GDP)",NV.AGR.TOTL.ZS,16.2591484896283,16.199507640393,15.2156122465127,14.8803489262722,14.4747261789547,13.8182553730866,12.9298794852362,12.3066684310428,11.7845285540387,12.6554035685556,12.6030904652746,11.9555291630892,11.9604858170749
Viet Nam,VNM,GDP per capita (current US$),NY.GDP.PCAP.CD,1950.92504174913,2185.11767654291,2359.51736472828,2546.38464459903,2577.56885340113,2735.0604380416,2956.10992127753,3222.31003125366,3440.90025375434,3534.03953482647,3704.1935590038,4116.38576094153,4282.08851724506
Viet Nam,VNM,"Manufacturing, value added (% of GDP)",NV.IND.MANF.ZS,18.694145538196,20.2740924828827,20.6874536915425,20.371229229791,20.9600916821922,21.4882532002034,22.6271239749306,23.3671679233065,23.7867165015145,23.9472430412931,24.4593726835113,24.5795734424262,23.8827677952544
Viet Nam,VNM,"Services, value added (% of GDP)",NV.SRV.TOTL.ZS,38.9070145300747,39.1188401087315,40.542010129242,40.9236092881482,42.1930087721287,42.8544900073075,42.5807243141144,42.1709178908888,42.4687227777403,41.8311604395691,41.2574400803722,41.3223541577905,42.5369982260521
Viet Nam,VNM,GDP (current US$),NY.GDP.MKTP.CD,172595049183.925,195590661129.249,213708811665.34,233451469642.519,239258328381.741,257096001177.982,281353605986.903,310106478394.659,334365270496.667,346615738537.796,366474752771.009,410324028883.325,429716969043.572
Viet Nam,VNM,"Inflation, consumer prices (annual %)",FP.CPI.TOTL.ZG,18.6777322770707,9.09470339557192,6.59267475899192,4.08455446637617,0.631200905175754,2.66824816969082,3.52025688811617,3.53962805942641,2.7958236745225,3.22093436652514,1.83471554810444,3.15650749963129,3.25289282667662
Viet Nam,VNM,Consumer price index (2010 = 100),FP.CPI.TOTL,118.677732277071,129.471120024261,138.006729874285,143.643689923265,144.550370194288,148.407332801278,153.631652156685,159.069641224583,163.516947912918,168.783721483338,171.880422664063,177.305841095852,183.073410082137
Viet Nam,VNM,Imports of goods and services (constant 2015 US$),NE.IMP.GNFS.KD,98409565289.224,109419238208.607,131214202609.755,148842285371.361,172245363653.847,191702712271.826,226610008550.01,248300287472.075,260353769079.3,268903208469.613,313679549128.566,317529219667.014,307661519600.864
Viet Nam,VNM,Imports of goods and services (current US$),NE.IMP.GNFS.CD,110599636247.243,116865795250,136871750776.669,153638953979.784,172245363653.847,183315160786.748,222881466764.772,248830928922.632,265976296626.188,273355953899.643,340182482326.143,369200955399.323,340107543990.226
Viet Nam,VNM,Exports of goods and services (constant 2015 US$),NE.EXP.GNFS.KD,100416953094.07,115521097963.377,136105245374.712,153227605903.683,174473996313.378,193673056479.846,227088468559.135,254914391799.685,270810924567.661,281812958435.956,323537430922.311,336532152627.219,332121699762.784
Viet Nam,VNM,Exports of goods and services (current US$),NE.EXP.GNFS.CD,105593919857.801,124149069364.151,142758439316.462,162478898406.019,174473996313.378,190526869544.715,230041803530.193,261802606599.094,284737397482.99,292479899128.742,343937314545.795,384931694296.977,374613210401.71
Viet Nam,VNM,"Foreign direct investment, net inflows (BoP, current US$)",BX.KLT.DINV.CD.WD,7430000000,8368000000,8900000000,9200000000,11800000000,12600000000,14100000000,15500000000,16120000000,15800000000,15660000000,17900000000,18500000000
Viet Nam,VNM,"Population, total",SP.POP.TOTL,88468314,89510356,90573104,91679578,92823254,94000117,95176977,96237319,97173776,98079191,98935098,99680655,100352192
Viet Nam,VNM,"Population ages 0-14, total",SP.POP.0014.TO,21431015,21488409,21679425,21975355,22270867,22684179,23241876,23658068,23845933,23920479,23939965,23858444,23688985
Viet Nam,VNM,"Population ages 15-64, total",SP.POP.1564.TO,61680692,62569513,63308890,63944581,64564555,65103693,65493771,65860328,66282521,66736820,67193405,67618446,68011678
Viet Nam,VNM,"Population ages 65 and above, total",SP.POP.65UP.TO,5356607,5452434,5584789,5759641,5987833,6212245,6441330,6718923,7045322,7421892,7801728,8203765,8651529
Viet Nam,VNM,"Unemployment, total (% of total labor force) (national estimate)",SL.UEM.TOTL.NE.ZS,0.999,1.027,1.316,1.256,1.849,1.848,1.874,1.161,1.681,2.103,2.385,1.523,1.645
Viet Nam,VNM,"International tourism, number of arrivals",ST.INT.ARVL,6014000,6848000,7572000,7874000,7944000,10013000,12922000,15498000,18009000,3837000,..,..,..
Viet Nam,VNM,"International tourism, expenditures (current US$)",ST.INT.XPND.CD,1710000000,1856000000,2050000000,2650000000,3595000000,4500000000,5040000000,5910000000,6460000000,4360000000,..,..,..
Viet Nam,VNM,"Industry (including construction), value added (% of GDP)",NV.IND.TOTL.ZS,34.580408780539,35.8602323946766,35.575150437736,35.2985684880333,34.2665466382117,34.1152288612372,35.3903640729728,36.5424334086447,36.8031368977554,36.7437132938801,37.39151924693,38.175376111625,37.1201018368351
Viet Nam,VNM,Carbon dioxide (CO2) emissions from Agriculture (Mt CO2e),EN.GHG.CO2.AG.MT.CE.AR5,2.399,2.6981,2.9189,2.7306,3.4114,3.1425,3.3155,3.3382,2.8962,2.569,3.0785,2.7572,2.6305
Viet Nam,VNM,Carbon dioxide (CO2) emissions from Building (Energy) (Mt CO2e),EN.GHG.CO2.BU.MT.CE.AR5,12.2569,11.3491,12.1844,11.8554,14.7209,14.2505,15.1296,15.0612,15.1043,14.5383,14.3692,15.4158,17.3736
Viet Nam,VNM,Carbon dioxide (CO2) emissions from Fugitive Emissions (Energy) (Mt CO2e),EN.GHG.CO2.FE.MT.CE.AR5,1.4434,2.1412,2.409,2.3573,2.2536,1.9714,2.1411,1.835,1.9879,1.7845,1.5733,1.7034,1.8664
Viet Nam,VNM,Carbon dioxide (CO2) emissions from Industrial Combustion (Energy) (Mt CO2e),EN.GHG.CO2.IC.MT.CE.AR5,43.322,42.7383,45.985,51.1315,33.2866,36.1575,37.9089,60.0704,73.9721,95.5738,95.8795,88.5516,107.0812
Viet Nam,VNM,Carbon dioxide (CO2) emissions from Industrial Processes (Mt CO2e),EN.GHG.CO2.IP.MT.CE.AR5,26.4642,25.6608,25.7697,27.7386,29.7888,34.6907,38.1481,41.1209,47.4515,50.0429,51.6523,53.4234,49.319
Viet Nam,VNM,Carbon dioxide (CO2) emissions from Power Industry (Energy) (Mt CO2e),EN.GHG.CO2.PI.MT.CE.AR5,40.2746,41.4662,44.4628,53.0142,84.0231,97.4142,93.6763,120.5426,153.9199,150.8808,142.3873,127.9552,155.3076
Viet Nam,VNM,Carbon dioxide (CO2) emissions from Transport (Energy) (Mt CO2e),EN.GHG.CO2.TR.MT.CE.AR5,30.5116,30.0571,29.2996,29.9625,33.1796,36.7853,40.0402,41.8466,43.5676,36.6267,32.1157,35.0434,39.3183
Viet Nam,VNM,Carbon dioxide (CO2) emissions from Waste (Mt CO2e),EN.GHG.CO2.WA.MT.CE.AR5,0.0195,0.0291,0.0388,0.04,0.0413,0.0426,0.0439,0.0452,0.0466,0.0479,0.0493,0.0506,0.052
Viet Nam,VNM,Carbon dioxide (CO2) emissions (total) excluding LULUCF (Mt CO2e),EN.GHG.CO2.MT.CE.AR5,156.6913,156.1398,163.0681,178.8301,200.7053,224.4548,230.4037,283.8603,338.946,352.0639,341.1051,324.9007,372.9485
,,,,,,,,,,,,,,,,
,,,,,,,,,,,,,,,,
,,,,,,,,,,,,,,,,
Data from database: World Development Indicators,,,,,,,,,,,,,,,,
Last Updated: 01/28/2025,,,,,,,,,,,,,,,,
Code,License Type,Indicator Name,Short definition,Long definition,Source,Topic,Dataset,Unit of measure,Periodicity,Base Period,Aggregation method,Statistical concept and methodology,Development relevance,Limitations and exceptions,General comments,License URL
NV.AGR.TOTL.ZS,CC BY-4.0,"Agriculture, forestry, and fishing, value added (% of GDP)",,"Agriculture, forestry, and fishing corresponds to ISIC divisions 1-3 and includes forestry, hunting, and fishing, as well as cultivation of crops and livestock production. Value added is the net output of a sector after adding up all outputs and subtracting intermediate inputs. It is calculated without making deductions for depreciation of fabricated assets or depletion and degradation of natural resources. The origin of value added is determined by the International Standard Industrial Classification (ISIC), revision 4. Note: For VAB countries, gross value added at factor cost is used as the denominator.","World Bank national accounts data, and OECD National Accounts data files.",Economic Policy & Debt: National accounts: Shares of GDP & other,,,Annual,,Weighted average,"Gross domestic product (GDP) represents the sum of value added by all its producers. Value added is the value of the gross output of producers less the value of intermediate goods and services consumed in production, before accounting for consumption of fixed capital in production. The United Nations System of National Accounts calls for value added to be valued at either basic prices (excluding net taxes on products) or producer prices (including net taxes on products paid by producers but excluding sales or value added taxes). Both valuations exclude transport charges that are invoiced separately by producers. Total GDP is measured at purchaser prices. Value added by industry is normally measured at basic prices.",,"Among the difficulties faced by compilers of national accounts is the extent of unreported economic activity in the informal or secondary economy. In developing countries a large share of agricultural output is either not exchanged (because it is consumed within the household) or not exchanged for money. Agricultural production often must be estimated indirectly, using a combination of methods involving estimates of inputs, yields, and area under cultivation. This approach sometimes leads to crude approximations that can differ from the true values over time and across crops for reasons other than climate conditions or farming techniques. Similarly, agricultural inputs that cannot easily be allocated to specific outputs are frequently "netted out" using equally crude and ad hoc approximations.","Note: Data for OECD countries are based on ISIC, revision 4.",https://datacatalog.worldbank.org/public-licenses#cc-by
NY.GDP.PCAP.CD,CC BY-4.0,GDP per capita (current US$),,GDP per capita is gross domestic product divided by midyear population. GDP is the sum of gross value added by all resident producers in the economy plus any product taxes and minus any subsidies not included in the value of the products. It is calculated without making deductions for depreciation of fabricated assets or for depletion and degradation of natural resources. Data are in current U.S. dollars.,"World Bank national accounts data, and OECD National Accounts data files.",Economic Policy & Debt: National accounts: US$ at current prices: Aggregate indicators,,,Annual,,Weighted average,"For more information, see the metadata for current U.S. dollar GDP (NY.GDP.MKTP.CD) and total population (SP.POP.TOTL).",,,,https://datacatalog.worldbank.org/public-licenses#cc-by
NV.IND.MANF.ZS,CC BY-4.0,"Manufacturing, value added (% of GDP)",,"Manufacturing refers to industries belonging to ISIC divisions 15-37. Value added is the net output of a sector after adding up all outputs and subtracting intermediate inputs. It is calculated without making deductions for depreciation of fabricated assets or depletion and degradation of natural resources. The origin of value added is determined by the International Standard Industrial Classification (ISIC), revision 3. Note: For VAB countries, gross value added at factor cost is used as the denominator.","World Bank national accounts data, and OECD National Accounts data files.",Economic Policy & Debt: National accounts: Shares of GDP & other,,,Annual,,Weighted average,"Gross domestic product (GDP) represents the sum of value added by all its producers. Value added is the value of the gross output of producers less the value of intermediate goods and services consumed in production, before accounting for consumption of fixed capital in production. The United Nations System of National Accounts calls for value added to be valued at either basic prices (excluding net taxes on products) or producer prices (including net taxes on products paid by producers but excluding sales or value added taxes). Both valuations exclude transport charges that are invoiced separately by producers. Total GDP is measured at purchaser prices. Value added by industry is normally measured at basic prices.",,"Ideally, industrial output should be measured through regular censuses and surveys of firms. But in most developing countries such surveys are infrequent, so earlier survey results must be extrapolated using an appropriate indicator. The choice of sampling unit, which may be the enterprise (where responses may be based on financial records) or the establishment (where production units may be recorded separately), also affects the quality of the data. Moreover, much industrial production is organized in unincorporated or owner-operated ventures that are not captured by surveys aimed at the formal sector. Even in large industries, where regular surveys are more likely, evasion of excise and other taxes and nondisclosure of income lower the estimates of value added. Such problems become more acute as countries move from state control of industry to private enterprise, because new firms and growing numbers of established firms fail to report. In accordance with the System of National Accounts, output should include all such unreported activity as well as the value of illegal activities and other unrecorded, informal, or small-scale operations. Data on these activities need to be collected using techniques other than conventional surveys of firms.","Note: Data for OECD countries are based on ISIC, revision 4.",https://datacatalog.worldbank.org/public-licenses#cc-by
NV.SRV.TOTL.ZS,CC BY-4.0,"Services, value added (% of GDP)",,"Services correspond to ISIC divisions 50-99 and they include value added in wholesale and retail trade (including hotels and restaurants), transport, and government, financial, professional, and personal services such as education, health care, and real estate services. Also included are imputed bank service charges, import duties, and any statistical discrepancies noted by national compilers as well as discrepancies arising from rescaling. Value added is the net output of a sector after adding up all outputs and subtracting intermediate inputs. It is calculated without making deductions for depreciation of fabricated assets or depletion and degradation of natural resources. The industrial origin of value added is determined by the International Standard Industrial Classification (ISIC), revision 3 or 4.","World Bank national accounts data, and OECD National Accounts data files.",Economic Policy & Debt: National accounts: Shares of GDP & other,,,Annual,,Weighted average,"Gross domestic product (GDP) represents the sum of value added by all its producers. Value added is the value of the gross output of producers less the value of intermediate goods and services consumed in production, before accounting for consumption of fixed capital in production. The United Nations System of National Accounts calls for value added to be valued at either basic prices (excluding net taxes on products) or producer prices (including net taxes on products paid by producers but excluding sales or value added taxes). Both valuations exclude transport charges that are invoiced separately by producers. Total GDP is measured at purchaser prices. Value added by industry is normally measured at basic prices.
Financial intermediation services indirectly measured (FISIM) is an indirect measure of the value of financial intermediation services (i.e. output) provided but for which financial institutions do not charge explicitly as compared to explicit bank charges. Although the 1993 SNA recommends that the FISIM are allocated as intermediate and final consumption to the users, many countries still make a global (negative) adjustment to the sum of gross value added.",,"In the services industry the many self-employed workers and one-person businesses are sometimes difficult to locate, and they have little incentive to respond to surveys, let alone to report their full earnings. Compounding these problems are the many forms of economic activity that go unrecorded, including the work that women and children do for little or no pay.",,https://datacatalog.worldbank.org/public-licenses#cc-by
NY.GDP.MKTP.CD,CC BY-4.0,GDP (current US$),,"GDP at purchaser's prices is the sum of gross value added by all resident producers in the economy plus any product taxes and minus any subsidies not included in the value of the products. It is calculated without making deductions for depreciation of fabricated assets or for depletion and degradation of natural resources. Data are in current U.S. dollars. Dollar figures for GDP are converted from domestic currencies using single year official exchange rates. For a few countries where the official exchange rate does not reflect the rate effectively applied to actual foreign exchange transactions, an alternative conversion factor is used.","World Bank national accounts data, and OECD National Accounts data files.",Economic Policy & Debt: National accounts: US$ at current prices: Aggregate indicators,,,Annual,,Gap-filled total,"Gross domestic product (GDP) represents the sum of value added by all its producers. Value added is the value of the gross output of producers less the value of intermediate goods and services consumed in production, before accounting for consumption of fixed capital in production. The United Nations System of National Accounts calls for value added to be valued at either basic prices (excluding net taxes on products) or producer prices (including net taxes on products paid by producers but excluding sales or value added taxes). Both valuations exclude transport charges that are invoiced separately by producers. Total GDP is measured at purchaser prices. Value added by industry is normally measured at basic prices.",,"Gross domestic product (GDP), though widely tracked, may not always be the most relevant summary of aggregated economic performance for all economies, especially when production occurs at the expense of consuming capital stock.

While GDP estimates based on the production approach are generally more reliable than estimates compiled from the income or expenditure side, different countries use different definitions, methods, and reporting standards. World Bank staff review the quality of national accounts data and sometimes make adjustments to improve consistency with international guidelines. Nevertheless, significant discrepancies remain between international standards and actual practice. Many statistical offices, especially those in developing countries, face severe limitations in the resources, time, training, and budgets required to produce reliable and comprehensive series of national accounts statistics.

Among the difficulties faced by compilers of national accounts is the extent of unreported economic activity in the informal or secondary economy. In developing countries a large share of agricultural output is either not exchanged (because it is consumed within the household) or not exchanged for money.",,https://datacatalog.worldbank.org/public-licenses#cc-by
FP.CPI.TOTL.ZG,CC BY-4.0,"Inflation, consumer prices (annual %)",,"Inflation as measured by the consumer price index reflects the annual percentage change in the cost to the average consumer of acquiring a basket of goods and services that may be fixed or changed at specified intervals, such as yearly. The Laspeyres formula is generally used.","International Monetary Fund, International Financial Statistics and data files.",Financial Sector: Exchange rates & prices,,,Annual,,Median,,,,,https://datacatalog.worldbank.org/public-licenses#cc-by
FP.CPI.TOTL,CC BY-4.0,Consumer price index (2010 = 100),,"Consumer price index reflects changes in the cost to the average consumer of acquiring a basket of goods and services that may be fixed or changed at specified intervals, such as yearly. The Laspeyres formula is generally used. Data are period averages.","International Monetary Fund, International Financial Statistics and data files.",Financial Sector: Exchange rates & prices,,,Annual,2010,,"Consumer price indexes are constructed explicitly, using surveys of the cost of a defined basket of consumer goods and services.","A general and continuing increase in an economy’s price level is called inflation. The increase in the average prices of goods and services in the economy should be distinguished from a change in the relative prices of individual goods and services. Generally accompanying an overall increase in the price level is a change in the structure of relative prices, but it is only the average increase, not the relative price changes, that constitutes inflation. A commonly used measure of inflation is the consumer price index, which measures the prices of a representative basket of goods and services purchased by a typical household. The consumer price index is usually calculated on the basis of periodic surveys of consumer prices. Other price indices are derived implicitly from indexes of current and constant price series.","Consumer price indexes should be interpreted with caution. The definition of a household, the basket of goods, and the geographic (urban or rural) and income group coverage of consumer price surveys can vary widely by country. In addition, weights are derived from household expenditure surveys, which, for budgetary reasons, tend to be conducted infrequently in developing countries, impairing comparability over time. Although useful for measuring consumer price inflation within a country, consumer price indexes are of less value in comparing countries.",,https://datacatalog.worldbank.org/public-licenses#cc-by
NE.IMP.GNFS.KD,CC BY-4.0,Imports of goods and services (constant 2015 US$),,"Imports of goods and services represent the value of all goods and other market services received from the rest of the world. They include the value of merchandise, freight, insurance, transport, travel, royalties, license fees, and other services, such as communication, construction, financial, information, business, personal, and government services. They exclude compensation of employees and investment income (formerly called factor services) and transfer payments. Data are in constant 2015 prices, expressed in U.S. dollars.","World Bank national accounts data, and OECD National Accounts data files.",Economic Policy & Debt: National accounts: US$ at constant 2015 prices: Expenditure on GDP,,,Annual,2015,Gap-filled total,"Gross domestic product (GDP) from the expenditure side is made up of household final consumption expenditure, general government final consumption expenditure, gross capital formation (private and public investment in fixed assets, changes in inventories, and net acquisitions of valuables), and net exports (exports minus imports) of goods and services. Such expenditures are recorded in purchaser prices and include net taxes on products.","An economy's growth is measured by the change in the volume of its output or in the real incomes of its residents. The 2008 United Nations System of National Accounts (2008 SNA) offers three plausible indicators for calculating growth: the volume of gross domestic product (GDP), real gross domestic income, and real gross national income. The volume of GDP is the sum of value added, measured at constant prices, by households, government, and industries operating in the economy. GDP accounts for all domestic production, regardless of whether the income accrues to domestic or foreign institutions.","Because policymakers have tended to focus on fostering the growth of output, and because data on production are easier to collect than data on spending, many countries generate their primary estimate of GDP using the production approach. Moreover, many countries do not estimate all the components of national expenditures but instead derive some of the main aggregates indirectly using GDP (based on the production approach) as the control total.

Data on exports and imports are compiled from customs reports and balance of payments data. Although the data from the payments side provide reasonably reliable records of cross-border transactions, they may not adhere strictly to the appropriate definitions of valuation and timing used in the balance of payments or corresponds to the change-of ownership criterion. This issue has assumed greater significance with the increasing globalization of international business. Neither customs nor balance of payments data usually capture the illegal transactions that occur in many countries. Goods carried by travelers across borders in legal but unreported shuttle trade may further distort trade statistics.",,https://datacatalog.worldbank.org/public-licenses#cc-by
